leak_normal.csv

Timestamp,Flow_Rate_LPM,Avg_Pressure_PSI,Occupancy_Status
2026-01-01,15.8,50.3,Class_Hours
2026-01-02,15.1,50.0,Class_Hours
2026-01-03,14.9,50.0,After_Hours
2026-01-04,15.4,50.6,After_Hours
2026-01-05,14.2,50.8,Class_Hours
2026-01-06,15.0,50.4,Class_Hours
2026-01-07,15.1,49.7,Class_Hours
2026-01-08,16.3,50.1,Class_Hours
2026-01-09,15.6,50.0,Class_Hours
2026-01-10,15.8,49.9,After_Hours
2026-01-11,15.8,50.3,After_Hours
2026-01-12,14.1,49.9,Class_Hours
2026-01-13,15.4,50.9,Class_Hours
2026-01-14,15.5,50.5,Class_Hours
2026-01-15,13.9,49.7,Class_Hours
2026-01-16,15.0,49.8,Class_Hours
2026-01-17,15.5,50.1,After_Hours
2026-01-18,15.1,50.0,After_Hours
2026-01-19,15.4,50.3,Class_Hours
2026-01-20,14.8,49.9,Class_Hours
2026-01-21,14.4,49.9,Class_Hours
2026-01-22,15.1,50.5,Class_Hours
2026-01-23,14.5,49.5,Class_Hours
2026-01-24,14.4,49.5,After_Hours
2026-01-25,15.2,51.0,After_Hours
2026-01-26,15.2,50.1,Class_Hours
2026-01-27,14.2,49.4,Class_Hours
2026-01-28,14.5,50.8,Class_Hours
2026-01-29,15.7,49.6,Class_Hours
2026-01-30,14.9,49.7,Class_Hours
2026-01-31,13.9,50.9,After_Hours
2026-02-01,14.3,50.0,After_Hours
2026-02-02,14.4,50.5,Class_Hours
2026-02-03,15.0,50.3,Class_Hours
2026-02-04,15.1,49.5,Class_Hours
2026-02-05,15.2,49.8,Class_Hours
2026-02-06,15.2,50.4,Class_Hours
2026-02-07,15.3,50.8,After_Hours
2026-02-08,14.8,50.2,After_Hours
2026-02-09,15.0,50.5,Class_Hours
2026-02-10,14.7,49.9,Class_Hours
2026-02-11,15.1,50.8,Class_Hours
2026-02-12,15.1,49.7,Class_Hours
2026-02-13,14.9,50.5,Class_Hours
2026-02-14,15.0,50.3,After_Hours
2026-02-15,15.7,50.6,After_Hours
2026-02-16,14.9,50.5,Class_Hours
2026-02-17,15.7,49.3,Class_Hours
2026-02-18,14.6,50.6,Class_Hours
2026-02-19,15.0,49.5,Class_Hours
2026-02-20,15.3,49.4,Class_Hours
2026-02-21,14.6,50.5,After_Hours
2026-02-22,14.8,49.7,After_Hours
2026-02-23,14.9,49.5,Class_Hours
2026-02-24,15.0,49.6,Class_Hours
2026-02-25,15.4,49.4,Class_Hours
2026-02-26,14.7,50.4,Class_Hours
2026-02-27,13.9,50.5,Class_Hours
2026-02-28,15.1,50.7,After_Hours
2026-03-01,14.9,50.0,After_Hours
2026-03-02,15.7,50.3,Class_Hours
2026-03-03,15.8,49.4,Class_Hours
2026-03-04,15.0,49.9,Class_Hours
2026-03-05,14.7,49.2,Class_Hours
2026-03-06,16.0,49.4,Class_Hours
2026-03-07,14.7,49.6,After_Hours
2026-03-08,15.3,50.9,After_Hours
2026-03-09,15.3,50.7,Class_Hours
2026-03-10,15.1,49.1,Class_Hours
2026-03-11,14.8,49.2,Class_Hours
2026-03-12,15.6,51.3,Class_Hours
2026-03-13,15.0,50.6,Class_Hours
2026-03-14,15.0,49.6,After_Hours
2026-03-15,15.2,49.5,After_Hours
2026-03-16,15.2,49.7,Class_Hours
2026-03-17,14.9,49.0,Class_Hours
2026-03-18,15.7,49.6,Class_Hours
2026-03-19,15.5,50.0,Class_Hours
2026-03-20,14.8,49.5,Class_Hours
2026-03-21,14.5,49.7,After_Hours
2026-03-22,15.3,49.8,After_Hours
2026-03-23,15.1,50.2,Class_Hours
2026-03-24,15.3,50.3,Class_Hours
2026-03-25,15.4,50.4,Class_Hours
2026-03-26,15.3,49.5,Class_Hours
2026-03-27,14.4,51.0,Class_Hours
2026-03-28,15.8,50.6,After_Hours
2026-03-29,15.1,49.9,After_Hours
2026-03-30,14.6,50.4,Class_Hours
2026-03-31,14.6,50.6,Class_Hours
2026-04-01,15.5,49.7,Class_Hours
2026-04-02,14.8,49.2,Class_Hours
2026-04-03,15.2,50.0,Class_Hours
2026-04-04,14.5,50.4,After_Hours
2026-04-05,15.0,50.2,After_Hours
2026-04-06,15.0,49.6,Class_Hours
2026-04-07,15.4,49.5,Class_Hours
2026-04-08,14.5,50.1,Class_Hours
2026-04-09,15.1,50.3,Class_Hours
2026-04-10,15.1,50.0,Class_Hours
2026-04-11,15.2,49.9,After_Hours
2026-04-12,15.2,51.0,After_Hours
2026-04-13,15.5,50.9,Class_Hours
2026-04-14,15.4,51.1,Class_Hours
2026-04-15,14.6,49.5,Class_Hours
2026-04-16,15.3,50.2,Class_Hours
2026-04-17,14.7,49.8,Class_Hours
2026-04-18,15.1,49.4,After_Hours
2026-04-19,15.1,50.5,After_Hours
2026-04-20,15.2,50.2,Class_Hours
2026-04-21,15.0,50.1,Class_Hours
2026-04-22,15.2,50.3,Class_Hours
2026-04-23,14.7,50.5,Class_Hours
2026-04-24,15.1,50.1,Class_Hours
2026-04-25,15.8,50.5,After_Hours
2026-04-26,15.2,50.1,After_Hours
2026-04-27,14.3,50.5,Class_Hours
2026-04-28,15.2,50.5,Class_Hours
2026-04-29,14.5,50.2,Class_Hours
2026-04-30,14.7,50.6,Class_Hours
2026-05-01,15.5,49.7,Class_Hours
2026-05-02,15.4,49.5,After_Hours
2026-05-03,15.1,50.0,After_Hours
2026-05-04,15.3,49.8,Class_Hours
2026-05-05,14.0,49.5,Class_Hours
2026-05-06,14.1,50.2,Class_Hours
2026-05-07,15.2,49.9,Class_Hours
2026-05-08,14.7,50.3,Class_Hours
2026-05-09,14.8,49.8,After_Hours
2026-05-10,15.5,50.7,After_Hours
2026-05-11,15.0,49.6,Class_Hours
2026-05-12,14.8,50.3,Class_Hours
2026-05-13,15.1,50.1,Class_Hours
2026-05-14,14.6,50.8,Class_Hours
2026-05-15,14.7,50.1,Class_Hours
2026-05-16,14.6,49.9,After_Hours
2026-05-17,14.6,50.2,After_Hours
2026-05-18,13.9,49.8,Class_Hours
2026-05-19,15.3,49.5,Class_Hours
2026-05-20,14.6,50.2,Class_Hours
2026-05-21,14.8,49.2,Class_Hours
2026-05-22,15.3,49.1,Class_Hours
2026-05-23,14.9,50.3,After_Hours
2026-05-24,14.3,49.9,After_Hours
2026-05-25,14.8,49.4,Class_Hours
2026-05-26,15.7,50.4,Class_Hours
2026-05-27,15.9,50.2,Class_Hours
2026-05-28,14.1,50.7,Class_Hours
2026-05-29,15.5,49.8,Class_Hours
2026-05-30,15.4,49.6,After_Hours
2026-05-31,15.2,49.9,After_Hours
2026-06-01,13.9,50.1,Class_Hours
2026-06-02,15.2,49.0,Class_Hours
2026-06-03,14.7,49.6,Class_Hours
2026-06-04,16.0,49.7,Class_Hours
2026-06-05,15.4,50.2,Class_Hours
2026-06-06,14.6,49.3,After_Hours
2026-06-07,14.8,49.7,After_Hours
2026-06-08,16.0,49.7,Class_Hours
2026-06-09,14.5,49.7,Class_Hours
2026-06-10,15.3,49.5,Class_Hours
2026-06-11,15.0,49.6,Class_Hours
2026-06-12,15.1,49.5,Class_Hours
2026-06-13,14.9,50.3,After_Hours
2026-06-14,14.5,50.0,After_Hours
2026-06-15,44.2,35.1,Class_Hours
2026-06-16,15.0,51.3,Class_Hours
2026-06-17,14.9,49.5,Class_Hours
2026-06-18,15.4,50.1,Class_Hours
2026-06-19,16.0,50.4,Class_Hours
2026-06-20,14.9,49.7,After_Hours
2026-06-21,15.5,50.0,After_Hours
2026-06-22,15.0,50.0,Class_Hours
2026-06-23,15.5,49.9,Class_Hours
2026-06-24,15.6,49.7,Class_Hours
2026-06-25,15.1,50.3,Class_Hours
2026-06-26,15.7,50.0,Class_Hours
2026-06-27,14.5,50.8,After_Hours
2026-06-28,15.7,50.3,After_Hours
2026-06-29,14.8,49.6,Class_Hours
2026-06-30,14.5,49.6,Class_Hours
2026-07-01,14.6,49.8,Class_Hours
2026-07-02,14.9,49.4,Class_Hours
2026-07-03,15.2,50.0,Class_Hours
2026-07-04,14.3,49.7,After_Hours
2026-07-05,15.7,49.5,After_Hours
2026-07-06,14.9,50.5,Class_Hours
2026-07-07,14.8,49.6,Class_Hours
2026-07-08,14.9,49.6,Class_Hours
2026-07-09,14.7,49.8,Class_Hours
2026-07-10,14.5,50.1,Class_Hours
2026-07-11,14.6,49.6,After_Hours
2026-07-12,14.9,50.3,After_Hours
2026-07-13,15.3,50.1,Class_Hours
2026-07-14,14.4,50.2,Class_Hours
2026-07-15,15.4,49.4,Class_Hours
2026-07-16,14.9,50.1,Class_Hours
2026-07-17,15.4,49.7,Class_Hours
2026-07-18,15.1,50.6,After_Hours
2026-07-19,15.3,50.3,After_Hours
2026-07-20,15.3,49.8,Class_Hours
2026-07-21,15.9,49.7,Class_Hours
2026-07-22,14.7,50.1,Class_Hours
2026-07-23,15.3,50.3,Class_Hours
2026-07-24,15.4,50.6,Class_Hours
2026-07-25,14.4,49.6,After_Hours
2026-07-26,14.0,49.5,After_Hours
2026-07-27,15.5,50.7,Class_Hours
2026-07-28,15.0,50.2,Class_Hours
2026-07-29,14.2,49.9,Class_Hours
2026-07-30,14.8,49.8,Class_Hours
2026-07-31,14.3,49.6,Class_Hours
2026-08-01,14.8,50.2,After_Hours
2026-08-02,15.2,50.4,After_Hours
2026-08-03,15.5,50.2,Class_Hours
2026-08-04,15.5,50.3,Class_Hours
2026-08-05,15.9,50.4,Class_Hours
2026-08-06,15.0,49.5,Class_Hours
2026-08-07,15.0,49.4,Class_Hours
2026-08-08,15.8,49.6,After_Hours
2026-08-09,15.1,49.8,After_Hours
2026-08-10,15.4,50.1,Class_Hours
2026-08-11,15.3,49.1,Class_Hours
2026-08-12,15.7,49.5,Class_Hours
2026-08-13,14.3,49.7,Class_Hours
2026-08-14,14.7,50.1,Class_Hours
2026-08-15,14.8,50.1,After_Hours
2026-08-16,14.3,49.4,After_Hours
2026-08-17,15.1,50.7,Class_Hours
2026-08-18,14.9,49.8,Class_Hours
2026-08-19,15.1,50.5,Class_Hours
2026-08-20,14.6,49.9,Class_Hours
2026-08-21,14.3,50.0,Class_Hours
2026-08-22,14.9,49.6,After_Hours
2026-08-23,15.6,50.4,After_Hours
2026-08-24,15.6,50.2,Class_Hours
2026-08-25,15.0,49.4,Class_Hours
2026-08-26,13.9,49.8,Class_Hours
2026-08-27,15.3,49.2,Class_Hours
2026-08-28,14.6,50.6,Class_Hours
2026-08-29,15.2,50.4,After_Hours
2026-08-30,14.5,50.3,After_Hours
2026-08-31,15.2,49.4,Class_Hours
2026-09-01,15.1,49.5,Class_Hours
2026-09-02,14.6,50.2,Class_Hours
2026-09-03,15.0,49.5,Class_Hours
2026-09-04,14.7,50.2,Class_Hours
2026-09-05,14.9,49.6,After_Hours
2026-09-06,14.5,50.4,After_Hours
2026-09-07,15.0,49.4,Class_Hours
2026-09-08,14.7,50.0,Class_Hours
2026-09-09,14.1,49.9,Class_Hours
2026-09-10,14.6,49.9,Class_Hours
2026-09-11,15.0,49.3,Class_Hours
2026-09-12,15.6,50.2,After_Hours
2026-09-13,14.1,50.0,After_Hours
2026-09-14,15.5,50.0,Class_Hours
2026-09-15,14.8,50.4,Class_Hours
2026-09-16,15.1,51.3,Class_Hours
2026-09-17,14.0,49.7,Class_Hours
2026-09-18,15.2,49.8,Class_Hours
2026-09-19,15.6,50.4,After_Hours
2026-09-20,14.7,50.5,After_Hours
2026-09-21,14.4,50.4,Class_Hours
2026-09-22,14.6,50.9,Class_Hours
2026-09-23,14.5,48.8,Class_Hours
2026-09-24,15.5,50.7,Class_Hours
2026-09-25,14.7,49.9,Class_Hours
2026-09-26,15.1,50.3,After_Hours
2026-09-27,14.8,49.4,After_Hours
2026-09-28,14.8,49.9,Class_Hours
2026-09-29,15.1,49.0,Class_Hours
2026-09-30,14.7,49.4,Class_Hours
2026-10-01,15.9,50.1,Class_Hours
2026-10-02,15.0,50.5,Class_Hours
2026-10-03,15.1,49.9,After_Hours
2026-10-04,14.6,50.1,After_Hours
2026-10-05,15.0,50.2,Class_Hours
2026-10-06,14.2,50.5,Class_Hours
2026-10-07,15.5,50.6,Class_Hours
2026-10-08,15.3,49.7,Class_Hours
2026-10-09,15.2,49.5,Class_Hours
2026-10-10,15.5,50.2,After_Hours
2026-10-11,15.3,49.9,After_Hours
2026-10-12,15.8,49.7,Class_Hours
2026-10-13,15.1,50.6,Class_Hours
2026-10-14,15.0,49.3,Class_Hours
2026-10-15,14.6,50.0,Class_Hours
2026-10-16,15.1,49.7,Class_Hours
2026-10-17,15.3,49.6,After_Hours
2026-10-18,14.7,50.1,After_Hours
2026-10-19,14.5,50.8,Class_Hours
2026-10-20,14.8,49.9,Class_Hours
2026-10-21,15.4,49.4,Class_Hours
2026-10-22,14.5,50.5,Class_Hours
2026-10-23,15.3,49.9,Class_Hours
2026-10-24,14.9,50.0,After_Hours
2026-10-25,14.4,50.8,After_Hours
2026-10-26,14.5,51.5,Class_Hours
2026-10-27,14.9,50.3,Class_Hours
2026-10-28,14.5,49.6,Class_Hours
2026-10-29,15.7,49.0,Class_Hours
2026-10-30,15.1,50.0,Class_Hours
2026-10-31,14.4,50.5,After_Hours
2026-11-01,14.9,49.6,After_Hours
2026-11-02,15.0,50.2,Class_Hours
2026-11-03,13.9,49.8,Class_Hours
2026-11-04,14.2,50.2,Class_Hours
2026-11-05,16.3,49.0,Class_Hours
2026-11-06,14.8,50.0,Class_Hours
2026-11-07,14.8,49.8,After_Hours
2026-11-08,15.7,49.5,After_Hours
2026-11-09,15.3,50.1,Class_Hours
2026-11-10,16.1,49.7,Class_Hours
2026-11-11,14.7,49.9,Class_Hours
2026-11-12,15.2,49.9,Class_Hours
2026-11-13,15.1,50.3,Class_Hours
2026-11-14,14.9,50.5,After_Hours
2026-11-15,15.5,49.6,After_Hours
2026-11-16,13.8,49.8,Class_Hours
2026-11-17,15.7,50.7,Class_Hours
2026-11-18,14.5,50.6,Class_Hours
2026-11-19,15.5,49.8,Class_Hours
2026-11-20,15.0,50.2,Class_Hours
2026-11-21,14.8,49.8,After_Hours
2026-11-22,15.6,50.7,After_Hours
2026-11-23,15.1,49.6,Class_Hours
2026-11-24,15.7,50.1,Class_Hours
2026-11-25,14.9,49.7,Class_Hours
2026-11-26,15.0,50.1,Class_Hours
2026-11-27,15.4,50.2,Class_Hours
2026-11-28,14.8,49.7,After_Hours
2026-11-29,15.4,48.8,After_Hours
2026-11-30,14.7,50.7,Class_Hours
2026-12-01,14.7,50.6,Class_Hours
2026-12-02,14.0,49.1,Class_Hours
2026-12-03,14.7,50.2,Class_Hours
2026-12-04,15.1,50.3,Class_Hours
2026-12-05,15.1,49.6,After_Hours
2026-12-06,14.6,49.4,After_Hours
2026-12-07,15.3,50.0,Class_Hours
2026-12-08,14.8,50.3,Class_Hours
2026-12-09,15.5,49.8,Class_Hours
2026-12-10,15.0,49.9,Class_Hours
2026-12-11,14.8,50.0,Class_Hours
2026-12-12,15.8,50.3,After_Hours
2026-12-13,15.9,50.5,After_Hours
2026-12-14,14.9,49.8,Class_Hours
2026-12-15,15.1,50.6,Class_Hours
2026-12-16,14.8,50.4,Class_Hours
2026-12-17,15.3,49.6,Class_Hours
2026-12-18,15.5,50.6,Class_Hours
2026-12-19,13.6,49.0,After_Hours
2026-12-20,14.5,50.0,After_Hours
2026-12-21,14.1,50.9,Class_Hours
2026-12-22,15.6,49.4,Class_Hours
2026-12-23,15.1,48.9,Class_Hours
2026-12-24,13.7,49.5,Class_Hours
2026-12-25,13.9,50.3,Class_Hours
2026-12-26,14.8,50.6,After_Hours
2026-12-27,14.9,50.6,After_Hours
2026-12-28,14.8,49.7,Class_Hours
2026-12-29,14.5,51.1,Class_Hours
2026-12-30,15.0,49.6,Class_Hours
2026-12-31,15.7,50.8,Class_Hours

TECHNICAL_AUDIT_REPORT.md

#### `normal.csv`

- Rows: 24
- Time span: 2026-06-01 00:00:00 -> 2026-06-01 23:00:00
- Flow: min 14.0, max 15.7, avg 14.70
- Pressure: min 49.6, max 50.8, avg 50.32
- Status distribution: `After_Hours:13`, `Class_Hours:11`

#### `event.csv`

- Rows: 24
- Time span: 2026-06-01 00:00:00 -> 2026-06-01 23:00:00
- Flow: min 14.1, max 20.0, avg 16.01
- Pressure: min 49.2, max 50.7, avg 50.06
- Status distribution: `After_Hours:13`, `Class_Hours:11`